{
  "rule_id": "IN_IBAMA_15_2009_r1",
  "norm_id": "IN_IBAMA_15_2009",
  "norm_type": "instrucao_normativa",
  "issuing_authority": "Instituto Brasileiro do Meio Ambiente e dos Recursos Naturais Renováveis (IBAMA)",
  "legal_basis": [
    "Decreto nº 6.099, de 26/04/2007, Anexo I, art. 2º, XVIII",
    "Decreto-Lei nº 221, de 28/02/1967",
    "Lei nº 8.617, de 04/01/1993",
    "Decreto nº 5.583, de 16/11/2005",
    "Processo IBAMA/Sede nº 02001.004889/2003-71"
  ],
  "species": [
    {"common_name": "sardinha-verdadeira", "scientific_name": "Sardinella brasiliensis"}
  ],
  "area": {
    "description": "Área compreendida entre os paralelos 22°00' Sul (Cabo de São Tomé, RJ) e 28°36' Sul (Cabo de Santa Marta, SC) — Art. 4º caput",
    "uf": ["RJ", "SP", "PR", "SC"],
    "geometry_status": "explicit_coordinates",
    "geometry_source": "Faixa latitudinal explícita na norma (22°00'S a 28°36'S); limite oeste = linha de costa, limite leste a definir (mar territorial/ZEE) — ver D11",
    "geometry_file": ""
  },
  "period": {
    "start": "11-01",
    "end": "02-15",
    "recurrence": "annual",
    "first_effective_year": 2009,
    "transitional_provisions": [
      "Art. 4º, parágrafo único: desembarque tolerado até 3 de novembro de cada ano"
    ]
  },
  "fishing_mode": ["captura da espécie (a norma limita o esforço da modalidade de cerco, Art. 1º)"],
  "gear": ["cerco/traineira (Art. 1º: esforço limitado às embarcações permissionadas no RGP)"],
  "affected_group": "Frota industrial de cerco (traineiras) permissionada no RGP entre RJ e SC",
  "exceptions": [],
  "seguro_defeso_linked": false,
  "enforcement_notes": "Art. 5º: declaração obrigatória de estoques às Superintendências Estaduais do IBAMA no dia 3 de novembro (rastro documental de compliance). Art. 7º: penalidades da Lei 9.605/1998 e Decreto 6.514/2008",
  "status": {
    "in_force_as_of": "2020-06-11",
    "revoked": true,
    "revoked_by": "IN MAPA nº 18, de 10/06/2020 (nova redação do Art. 4º; ver IN_MAPA_18_2020_r1)",
    "amended_by": ["IN_MAPA_18_2020"],
    "amendment_check_pending": false
  },
  "source": {
    "publication_date": "2009-05-22",
    "dou_reference": "DOU 22/05/2009, Edição 96, Seção 1, p. 81 (assinada em 21/05/2009)",
    "official_source_url": "https://www.gov.br/ibama/pt-br/assuntos/biodiversidade/biodiversidade-aquatica/arquivos/defesos-marinho/2025-01-14_sardinha_verdadeira_in_ibama_n-o-15_2009.pdf",
    "local_files": [
      "data/legal/corpus_defesos_marinhos/sardinha_verdadeira_in_ibama_n-o-15_2009.pdf",
      "data/legal/corpus_defesos_marinhos/sardinha_verdadeira_in_ibama_n-o-15_2009.txt"
    ],
    "sha256": {"note": "ver data/metadata/checksums_legal.txt"}
  },
  "extraction": {
    "method": "pdf_text_assisted",
    "extracted_at": "2026-09-10",
    "extracted_by": "Claude (assistente); recorte do ato dentro da página do DOU por python/screen_legal_corpus.py, campos lidos do Art. 4º, I"
  },
  "validation": {
    "human_validated": false,
    "validated_by": null,
    "validated_at": null,
    "open_issues": [
      "Confirmar o limite LESTE da área (a norma fixa só a faixa latitudinal): mar territorial (12 mn) ou ZEE? Afeta o polígono operacional — decisão D11",
      "Confirmar se a sardinha gera Seguro-Defeso: marcado false porque a frota de cerco é industrial e o benefício da Lei 10.779/2003 é do pescador artesanal — conferir se há artesanais elegíveis nesta pescaria"
    ]
  },
  "version": 1,
  "notes": "DEFESO DE REPRODUÇÃO (1ª das duas janelas anuais do regime 2009-2020). A segunda janela (recrutamento, 15/06-31/07) está em IN_IBAMA_15_2009_r2. ATENÇÃO METODOLÓGICA: a tabela-resumo de defesos marinhos do IBAMA (acesso 2026-09-03) atribui a esta IN o período '01/10-28/02', que na verdade é a redação DADA PELA IN MAPA 18/2020 — o resumo oficial não distingue o regime original do alterado. Achado documentado para a seção de SI do artigo."
}
