{
  "rule_id": "INI_MPA_MMA_02_2009_r1",
  "norm_id": "INI_MPA_MMA_02_2009",
  "norm_type": "portaria_interministerial",
  "issuing_authority": "MPA/MMA (Instrução Normativa Interministerial)",
  "legal_basis": [
    "ver preâmbulo no texto (não transcrito)"
  ],
  "species": [
    {
      "common_name": "anchova",
      "scientific_name": "Pomatomus saltatrix"
    }
  ],
  "area": {
    "description": "litoral sul do país (Art. 4º)",
    "uf": [
      "PR",
      "SC",
      "RS"
    ],
    "geometry_status": "named_area_unresolved",
    "geometry_source": "",
    "geometry_file": ""
  },
  "period": {
    "start": "12-01",
    "end": "03-31",
    "recurrence": "annual",
    "first_effective_year": 2009,
    "transitional_provisions": []
  },
  "fishing_mode": [
    "captura"
  ],
  "gear": [],
  "affected_group": "",
  "exceptions": [],
  "seguro_defeso_linked": false,
  "enforcement_notes": "",
  "status": {
    "in_force_as_of": "2026-09-11",
    "revoked": false,
    "revoked_by": "",
    "amended_by": [],
    "amendment_check_pending": true
  },
  "source": {
    "publication_date": "",
    "dou_reference": "",
    "official_source_url": "https://www.gov.br/ibama/pt-br/assuntos/biodiversidade/biodiversidade-aquatica/periodos-de-defeso/defesos-marinhos",
    "local_files": [
      "data/legal/corpus_defesos_marinhos/anchova_ini_mpa_mma_n-o-02_2009.pdf"
    ],
    "sha256": {
      "note": "ver data/metadata/checksums_legal.txt"
    }
  },
  "extraction": {
    "method": "pdf_text_assisted",
    "extracted_at": "2026-09-11",
    "extracted_by": "Claude (assistente), a partir dos dispositivos isolados por python/screen_legal_corpus.py"
  },
  "validation": {
    "human_validated": false,
    "validated_by": null,
    "validated_at": null,
    "open_issues": [
      "data de publicação e nº do DOU a confirmar (cabeçalho não detectado na página)",
      "nome científico não citado no dispositivo lido — atribuído pela tabela IBAMA",
      "delimitar 'litoral sul' (UFs pela tabela IBAMA)"
    ]
  },
  "version": 1,
  "notes": "Art. 4º: proibir anualmente de 1º/dez a 31/mar a captura da anchova no litoral sul."
}
